paperID,paper title,publish years,authors
628035,mixed membership matrix factorization,2010-01-01,lester w mackey;david weiss;michael i jordan
665341,topic correlation analysis for cross domain text classification,2012-07-22,lianghao li;xiaoming jin;mingsheng long
1407234,multi class leveraged,2010-01-01,paolo piro;richard nock;frank nielsen;michel barlaud
1788602,semantic relatedness using salient semantic analysis,2011-08-07,samer hassan;rada mihalcea
2581345,intrinsic image decomposition using structure texture separation and surface normals,2014-09-06,junho jeon;sunghyun cho;xin tong;seungyong lee
3038044,group chats on twitter,2013-05-13,james cook;krishnaram kenthapadi;nina mishra
3628245,hierarchical gaussian process regression,2010-01-01,sunho park;seungjin choi
4919037,regularization of neural networks using dropconnect,2013-01-01,li wan;matthew d zeiler;sixin zhang;yann le cun;rob fergus
11297145,coupled bayesian sets algorithm for semi supervised learning and information extraction,2012-09-24,saurabh verma;estevam r hruschka
11480360,future locations prediction with uncertain data,2013-09-23,disheng qiu;paolo papotti;lorenzo blanco
15375276,multi modal distance metric learning,2013-08-03,pengtao xie;eric p xing
15962362,fourier kernel learning,2012-10-07,eduard gabriel băźzăźvan;fuxin li;cristian sminchisescu
16472989,authorship attribution of micro messages,2013-10-01,roy schwartz;oren tsur;ari rappoport;moshe koppel
17346433,fast approximate nearest neighbor search with k nearest neighbor graph,2011-07-16,kiana hajebi;yasin abbasiyadkori;hossein shahbazi;hong zhang
17568124,gesture based robot control,2012-09-24,tomasz grzejszczak;michal mikulski;tadeusz szkodny;karol jedrasiak
19169051,fast allocation of gaussian process experts,2014-01-01,trung v nguyen;edwin v bonilla
21006490,wsabie scaling up to large vocabulary image annotation,2011-07-16,jason weston;samy bengio;nicolas usunier
21077339,decision management tool,2010-01-01,garry mitchell;warwick graco;hari koesmarno
22157125,semantic based process analysis,2014-10-19,chiara di francescomarino;francesco corcoglioniti;mauro dragoni;piergiorgio bertoli;roberto tiella;chiara ghidini;michele nori;marco pistore
26944259,robust visual robot localization across seasons using network flows,2014-07-27,tayyab naseer;luciano spinello;wolfram burgard;cyrill stachniss
28516297,ensemble methods for structured prediction,2014-01-01,corinna cortes;vitaly kuznetsov;mehryar mohri
32250364,a ast sampling,2014-01-01,chris j maddison;daniel tarlow;thomas p minka
33832734,nonparametric mixture of gaussian processes with constraints,2013-01-01,james c ross;james c ross;jennifer g dy
35527955,fast dropout training,2013-01-01,sida i wang;christopher d manning
40954061,interactive multi label segmentation,2010-11-08,jakob santner;thomas pock;horst bischof
42170355,labels in the web of data,2011-10-23,basil ell;denny vrandecic;elena simperl
43307813,online non parametric regression,2014-01-01,alexander rakhlin;karthik sridharan
43928412,visually extracting data records from the deep web,2013-05-13,neil anderson;jun hong
46376622,monocular multiview object tracking with 3d aspect parts,2014-09-06,yu xiang;yu xiang;changkyu song;roozbeh mottaghi;silvio savarese
50294972,structured prediction of network response,2014-01-01,hongyu su;hongyu su;aristides gionis;aristides gionis;juho rousu;juho rousu
53542644,shape from angle regularity,2012-10-07,aamer zaheer;maheen rashid;sohaib khan
55051199,true online td lambda,2014-01-01,harm van seijen;richard s sutton
55377555,efficient joint segmentation occlusion labeling stereo and flow estimation,2014-09-06,koichiro yamaguchi;david a mcallester;raquel urtasun
55636956,transforming trees to improve syntactic convergence,2012-07-01,david burkett;d klein
56210758,generalized principal component analysis,2016-04-26,rene vidal;yi ma;shankar sastry
56306824,a smart problem solving environment,2013-07-01,nguyenthinh le;niels pinkwart
56660187,parallel gaussian process regression for big data low rank representation meets markov approximation,2015-01-25,kian hsiang low;jiangbo yu;jie chen;patrick jaillet
58821489,introduction to causal inference,2010-03-01,peter spirtes
61129706,unsupervised temporal commonality discovery,2012-10-07,wensheng chu;feng zhou;fernando de la torre
61729836,schema an algorithm for automated product taxonomy mapping in e commerce,2012-05-27,steven s aanen;lennart j nederstigt;damir vandic;flavius frăsincar
63668830,entity search on the web,2013-05-13,peter mika
64813323,large scale object classification using label relation graphs,2014-01-01,jia deng;jia deng;nan ding;yangqing jia;andrea frome;kevin p murphy;samy bengio;yuan li;hartmut neven;hartwig adam
66673523,a machine learning approach for instance matching based on similarity metrics,2012-11-11,shu rong;xing niu;evan wei xiang;haofen wang;qiang yang;yong yu
68180256,local ordinal embedding,2014-01-01,yoshikazu terada;yoshikazu terada;ulrike von luxburg
68293321,knowledge powered deep learning for word embedding,2014-09-15,jiang bian;bin gao;tieyan liu
70460941,a multi scale vectorial l,2011-01-01,yiqiu dong;michael hintermuller;m monserrat rinconcamacho
70975097,deep features for text spotting,2014-09-06,max jaderberg;andrea vedaldi;andrew zisserman
71666767,consistent re identification in a camera network,2014-09-06,abir das;anirban chakraborty;amit k roychowdhury
71795751,semi supervised recursive autoencoders for predicting sentiment distributions,2011-07-01,richard socher;jeffrey pennington;eric h huang;andrew y ng;christopher d manning
72509839,image information in digital photography,2010-11-08,jaume rigau;miquel feixas;mateu sbert
77191723,on broken triangles,2016-07-09,martin c cooper;achref el mouelhi;cyril terrioux;bruno zanuttini
79158146,learning by stretching deep networks,2014-01-01,gaurav pandey;ambedkar dukkipati
83981013,inferno an intelligent framework for recognizing pornographic web pages,2011-09-05,sotiris karavarsamis;nikos ntarmos;konstantinos blekas
85461845,how document properties affect document relatedness measures,2014-04-06,jessica perrie;aminul islam;evangelos e milios
87060577,parallel structural graph clustering,2011-09-05,madeleine seeland;simon a berger;alexandros stamatakis;stefan kramer
92741151,location based insights from the social web,2013-05-13,yohei ikawa;maja vukovic;jakob rogstadius;akiko murakami
102036530,fast max margin matrix factorization with data augmentation,2013-01-01,minjie xu;jun zhu;bo zhang
102905824,efficient label propagation,2014-01-01,yasuhiro fujiwara;go irie
103340358,pathsim meta path based top k similarity search in heterogeneous information networks,2011-08-01,yizhou sun;jiawei han;xifeng yan;philip s yu;tianyi wu
104552425,analyzing schema org,2014-10-19,peter f patelschneider
104741324,measuring web quality,2013-05-13,ricardo a baezayates
106645359,information privacy and its value,2010-03-23,sabah alfedaghi
108223363,vanishing component analysis,2013-01-01,roi livni;david lehavi;sagi schein;hila nachliely;shai shalevshwartz;amir globerson
108913070,representing translations on the semantic web,2011-10-23,elena montielponsoda;jorge gracia;guadalupe aguadodecea;asuncion gomezperez
113059239,online social spammer detection,2014-07-27,xia hu;jiliang tang;huan liu
114246147,the web as a laboratory,2013-05-13,bebo white
114730584,an efficient approach for assessing hyperparameter importance,2014-01-01,frank hutter;holger h hoos;kevin leytonbrown
117952040,social media journalism and the public,2013-05-13,steve schifferes
118481696,making k means even faster,2010-01-01,greg hamerly
120692785,robust unsupervised feature selection,2013-08-03,mingjie qian;chengxiang zhai
128329261,computational disaster management,2013-08-03,pascal van hentenryck
131378802,composite objective mirror descent,2010-01-01,john c duchi;shai shalevshwartz;yoram singer;ambuj tewari
132828864,clustering based k anonymity,2012-05-29,xianmang he;huahui chen;yefang chen;yihong dong;peng wang;zhenhua huang
133182883,depth recovery using an adaptive color guided auto regressive model,2012-10-07,jingyu yang;xinchen ye;kun li;chunping hou
133251416,multi kernel gaussian processes,2011-07-16,arman melkumyan;fabio ramos
133394268,data science and machine learning at scale,2011-09-05,neel sundaresan
134985385,modular community detection in networks,2011-07-16,wenye li;dale schuurmans
136235603,fast and accurate influence maximization on large networks with pruned monte carlo simulations,2014-07-27,naoto ohsaka;takuya akiba;yuichi yoshida;kenichi kawarabayashi
136983338,learning for deep language understanding,2011-07-16,smaranda muresan
138476454,circulant binary embedding,2014-01-01,felix x yu;sanjiv kumar;yunchao gong;shihfu chang
139420056,the mash project,2011-09-05,francois fleuret;philip abbet;charles dubout;leonidas lefakis
141352744,zero shot learning via visual abstraction,2014-09-06,stanislaw antol;c lawrence zitnick;devi parikh
142463596,risk minimization probability elicitation and cost sensitive svms,2010-06-21,hamed masnadishirazi;nuno vasconcelos
143806433,feature selection for transfer learning,2011-09-05,selen uguroglu;jaime g carbonell
146125889,bayes optimal multilabel classification via probabilistic classifier chains,2010-01-01,weiwei cheng;eyke h llermeier;krzysztof dembczynski;krzysztof dembczynski
146395692,describing clothing by semantic attributes,2012-10-07,huizhong chen;andrew c gallagher;bernd girod
153210175,bioinformatics contributions to data mining,2010-07-12,isabelle bichindaritz
154472438,multimodal learning with deep boltzmann machines,2014-01-01,nitish srivastava;ruslan salakhutdinov
156852397,sempala interactive sparql query processing on hadoop,2014-10-19,alexander schatzle;martin przyjacielzablocki;antony neu;georg lausen
157251712,multi assignment clustering for boolean data,2012-01-01,mario frank;andreas p streich;david a basin;joachim m buhmann
159595522,streaming hierarchical video segmentation,2012-10-07,chenliang xu;caiming xiong;jason j corso
160238578,stroke width transform,2010-01-01,boris epshtein;eyal ofek;yonathan wexler
161114242,exploiting the circulant structure of tracking by detection with kernels,2012-10-07,joao f henriques;rui caseiro;pedro martins;jorge batista
161751758,learning a set of directions,2013-01-01,wouter m koolen;jiazhong nie;manfred k warmuth
163401298,feature selection in high dimensional classification,2013-01-01,mladen kolar;han liu
166429404,person re identification using kernel based metric learning methods,2014-09-06,fei xiong;mengran gou;octavia i camps;mario sznaier
168460524,recursive bilateral filtering,2012-10-07,qingxiong yang
169520950,client server web applications widgets,2013-05-13,vincent balat
170472577,bayesian face revisited a joint formulation,2012-10-07,dong chen;xudong cao;liwei wang;fang wen;jian sun
170967611,fast image tagging,2013-01-01,minmin chen;alice x zheng;kilian q weinberger
174104394,online graph based tracking,2014-09-06,hyeonseob nam;seunghoon hong;bohyung han
178058951,trust mechanisms for online systems,2011-07-16,jens witkowski
186937751,classifier ensemble recommendation,2012-10-07,pyry matikainen;rahul sukthankar;martial hebert
190007845,patchmatchgraph building a graph of dense patch correspondences for label transfer,2012-10-07,stephen gould;yuhang zhang
192074925,team activity recognition in sports,2012-10-07,cem direkoǧlu;noel e o connor
193661306,replication for linked data,2012-11-11,laurens rietveld
194198717,dependency parsers for persian,2012-12-01,mojgan seraji;beata megyesi;joakim nivre
196214544,generating text with recurrent neural networks,2011-01-01,ilya sutskever;james martens;geoffrey e hinton
199097577,distributed k means and k median clustering on general communication topologies,2013-01-01,mariaflorina balcan;steven ehrlich;yingyu liang
199559790,security and privacy of data in a cloud,2013-08-30,sushil jajodia
202444872,the linked data platform ldp,2013-05-13,arnaud j le hors;steve speicher
203656765,conic multi task classification,2014-09-15,cong li;michael georgiopoulos;georgios c anagnostopoulos
204268067,neural codes for image retrieval,2014-09-06,artem babenko;artem babenko;anton viktorovich slesarev;alexander chigorin;victor s lempitsky
204612701,joint cascade face detection and alignment,2014-09-06,dong chen;shaoqing ren;yichen wei;xudong cao;jian sun
207344062,hand waving away scale,2014-09-06,christopher c w ham;simon lucey;surya p n singh
207557899,gaussian processes multiple instance learning,2010-01-01,minyoung kim;fernando de la torre
207664590,on clustering graph streams,2010-12-01,charu c aggarwal;yuchen zhao;philip s yu
209424029,dense semantic correspondence where every pixel is a classifier,2015-12-01,hilton bristow;jack valmadre;simon lucey
210657420,discovering object classes from activities,2014-09-06,abhilash srikantha;abhilash srikantha;juergen gall
217817341,from think like a vertex to think like a graph,2013-11-01,yuanyuan tian;andrey balmin;severin andreas corsten;shirish tatikonda;john mcpherson
219040644,unsupervised learning of visual representations using videos,2015-12-01,xiaolong wang;abhinav gupta
226250005,on sampling focal length values to solve the absolute pose problem,2014-09-06,torsten sattler;chris sweeney;marc pollefeys
242449877,a 3d scene registration method via covariance descriptors and an evolutionary stable strategy game theory solver,2015-12-01,pol cirujeda;yashin dicente cid;xavier mateo;xavier binefa
245913453,it takes heart to win what makes the heart powerful,2010-01-01,philip a wahr;joseph m metzger;kerry s mcdonald;todd j herron
261873710,geodesic object proposals,2014-09-06,philipp krahenbuhl;vladlen koltun
280920822,building on deep learning,2013-07-15,marc pickett
281061080,a multi stage approach to curve extraction,2014-09-06,yuliang guo;naman kumar;maruthi narayanan;benjamin b kimia
288657196,to follow or not to follow a feature evaluation,2013-05-13,yanan zhu;nazli goharian
297461772,large scale multi view spectral clustering via bipartite graph,2015-01-25,yeqing li;feiping nie;heng huang;junzhou huang
299440670,variational inference with normalizing flows,2015-01-01,danilo jimenez rezende;shakir mohamed
300217873,in search of art,2014-09-06,elliot j crowley;andrew zisserman
310586462,perceptually inspired layout aware losses for image segmentation,2014-09-06,anton osokin;pushmeet kohli
318042436,learning temporal embeddings for complex video analysis,2015-12-01,vignesh ramanathan;kevin tang;greg mori;li feifei
340337472,learning submodular functions,2012-09-24,mariaflorina balcan;nicholas j a harvey
341540352,natural temporal difference learning,2014-07-27,william dabney;philip s thomas
343636949,unsupervised visual representation learning by context prediction,2015-12-01,carl doersch;abhinav gupta;alexei a efros
343811051,learning low rank representations with classwise block diagonal structure for robust face recognition,2014-07-27,yong li;jing liu;zechao li;yangmuzi zhang;hanqing lu;songde ma
345900524,convolutional channel features,2015-12-01,bin yang;junjie yan;zhen lei;stan z li
410850256,mllib machine learning in apache spark,2016-01-01,xiangrui meng;joseph k bradley;burak yavuz;evan r sparks;shivaram venkataraman;davies liu;jeremy freeman;d b tsai;manish amde;sean owen;doris xin;reynold s xin;michael j franklin;reza bosagh zadeh;matei zaharia;ameet talwalkar
415742285,humanoid robots and spoken dialog systems for brief health interventions,2014-09-24,saminda abeyruwan;ramesh baral;ugan yasavur;christine l lisetti;ubbo visser
432572086,correcting for duplicate scene structure in sparse 3d reconstruction,2014-09-06,jared heinly;enrique dunn;jan michael frahm
437896048,rotation invariant co occurrence among adjacent lbps,2012-11-05,ryusuke nosaka;chendra hadi suryanto;kazuhiro fukui
564250221,forecasting uncertainty in electricity demand,2015-01-01,tri kurniawan wijaya;mathieu sinn;bei chen
571574196,deterministic independent component analysis,2015-01-01,ruitong huang;andras gyorgy;csaba szepesv ri
572355794,the extreme value machine,2018-03-01,ethan m rudd;lalit p jain;walter j scheirer;terrance e boult
581810680,sign language recognition using convolutional neural networks,2014-09-06,lionel pigou;sander dieleman;pieterjan kindermans;benjamin schrauwen
582055897,learning multiple tasks with deep relationship networks,2015-01-01,mingsheng long;jianmin wang
582134693,dropout as a bayesian approximation representing model uncertainty in deep learning,2016-06-19,yarin gal;zoubin ghahramani
586034241,decoupled deep neural network for semi supervised semantic segmentation,2015-12-07,seunghoon hong;hyeonwoo noh;bohyung han
586437690,expectation particle belief propagation,2015-12-07,thibaut lienart;yee whye teh;arnaud doucet
592244745,a recurrent latent variable model for sequential data,2015-12-07,junyoung chung;kyle kastner;laurent dinh;kratarth goel;aaron c courville;yoshua bengio
602632650,visualising bag of words,2011-01-01,jasper r r uijlings;arnold w m smeulders
603830301,active learning by learning,2015-01-25,weining hsu;hsuantien lin
603908379,spatial transformer networks,2015-12-07,max jaderberg;karen simonyan;andrew zisserman;koray kavukcuoglu
612478963,lsd slam large scale direct monocular slam,2014-09-06,jakob engel;thomas schops;daniel cremers
630216852,fast and guaranteed tensor decomposition via sketching,2015-12-07,yining wang;hsiaoyu fish tung;alexander j smola;animashree anandkumar
639708223,faster r cnn towards real time object detection with region proposal networks,2017-06-01,shaoqing ren;kaiming he;ross b girshick;jian sun
647891877,fast two sample testing with analytic representations of probability measures,2015-12-07,kacper p chwialkowski;aaditya ramdas;dino sejdinovic;arthur gretton
648143168,deep generative image models using a laplacian pyramid of adversarial networks,2015-12-07,emily l denton;soumith chintala;arthur szlam;rob fergus
650350307,deep knowledge tracing,2015-12-07,chris piech;jonathan bassen;jonathan huang;surya ganguli;mehran sahami;leonidas j guibas;jascha sohldickstein
652269744,an embarrassingly simple approach to zero shot learning,2015-01-01,bernardino romeraparedes;philip h s torr
655994999,a dependency parser for tweets,2014-10-01,lingpeng kong;nathan schneider;swabha swayamdipta;archna bhatia;chris dyer;noah a smith
658020064,from word embeddings to document distances,2015-01-01,matt j kusner;yu sun;nicholas i kolkin;kilian q weinberger
744717813,a pac bayes sample compression approach to kernel methods,2011-01-01,pascal germain;alexandre lacoste;mario marchand;sara shanian;fran ois laviolette
753012316,torch7 a matlab like environment for machine learning,2011-01-01,ronan collobert;koray kavukcuoglu;clement farabet
753617165,relational linear programming,2017-03-01,kristian kersting;martin mladenov;pavel tokmakov
759139936,convolutional color constancy,2015-12-01,jonathan t barron
769612788,distributional smoothing with virtual adversarial training,2016-01-01,takeru miyato;shinichi maeda;masanori koyama;ken nakae;shin ishii
785130179,robust winners and winner determination policies under candidate uncertainty,2014-07-27,craig boutilier;jerome lang;joel oren;hector palacios
786900578,i didn t sign up for this informed consent in social network research,2015-04-21,luke hutton;tristan henderson
791281155,fast provable algorithms for isotonic regression in all l p norms,2015-12-07,rasmus kyng;anup rao;sushant sachdeva
797227816,predicting the demographics of twitter users from website traffic data,2015-01-25,aron culotta;nirmal kumar ravi;jennifer cutler
805710393,unsupervised semantic parsing of video collections,2015-12-01,ozan sener;amir roshan zamir;silvio savarese;ashutosh saxena
819977924,deep filter banks for texture recognition description and segmentation,2016-05-01,mircea cimpoi;subhransu maji;iasonas kokkinos;andrea vedaldi
830076066,semi supervised learning with ladder networks,2015-12-07,antti rasmus;harri valpola;mikko honkala;mathias berglund;tapani raiko
834081922,embed to control a locally linear latent dynamics model for control from raw images,2015-12-07,manuel watter;jost tobias springenberg;joschka boedecker;martin a riedmiller
847916222,solving motion planning problems,2014-01-01,andre grahl pereira;marcus ritt;luciana s buriol
858396460,fast convergence of regularized learning in games,2015-12-07,vasilis syrgkanis;alekh agarwal;haipeng luo;robert e schapire
880392029,rich component analysis,2016-06-19,rong ge;james zou
889023230,building end to end dialogue systems using generative hierarchical neural network models,2016-02-12,iulian vlad serban;alessandro sordoni;yoshua bengio;aaron c courville;joelle pineau
901252737,inducing semantic relations from conceptual spaces,2015-11-01,joaquin derrac;steven schockaert
907995911,teaching icub to recognize objects using deep convolutional neural networks,2015-01-01,giulia pasquale;carlo ciliberto;francesca odone;lorenzo rosasco;lorenzo natale
918148966,regularization path of cross validation error lower bounds,2015-12-07,atsushi shibagaki;yoshiki suzuki;masayuki karasuyama;ichiro takeuchi
926830766,a neural probabilistic model for context based citation recommendation,2015-01-25,wenyi huang;zhaohui wu;chen liang;prasenjit mitra;c lee giles
963972349,using matched samples to estimate the effects of exercise on mental health from twitter,2015-01-25,virgile landeiro dos reis;aron culotta
971840466,detecting promotional content in wikipedia,2013-10-01,shruti bhosale;heath vinicombe;raymond j mooney
975780734,multi task multi sample learning,2014-09-06,yusuf aytar;andrew zisserman
1003853626,interactive object counting,2014-09-06,carlos arteta;victor s lempitsky;j alison noble;andrew zisserman
1004439037,why assessing relevance in medical ir is demanding,2014-07-01,bevan koopman;guido zuccon
1026270304,training very deep networks,2015-12-07,rupesh kumar srivastava;klaus greff;jurgen schmidhuber
1032684693,context as supervisory signal discovering objects with predictable context,2014-09-06,carl doersch;abhinav gupta;alexei a efros
1061761516,geo social media analytics,2015-05-18,cheng te li;hsun ping hsieh
1067145707,deep learning for the web,2015-05-18,kyomin jung;byoungtak zhang;prasenjit mitra
1202352811,effective deep learning based multi modal retrieval,2016-02-01,wei wang;xiaoyan yang;beng chin ooi;dongxiang zhang;yueting zhuang
1236989346,robust vertex classification,2016-03-01,li chen;cencheng shen;joshua t vogelstein;carey e priebe
1237089097,scene semantics from long term observation of people,2012-10-07,vincent delaitre;david f fouhey;ivan laptev;josef sivic;abhinav gupta;alexei a efros
1257569579,fast training of support vector machines for survival analysis,2015-09-07,sebastian polsterl;nassir navab;amin katouzian
1411846290,generalization in unsupervised learning,2015-09-07,karim t aboumoustafa;dale schuurmans
1423339008,parsing natural scenes and natural language with recursive neural networks,2011-01-01,richard socher;cliff chiungyu lin;christopher d manning;andrew y ng
1431516446,less is more nystrom computational regularization,2015-12-07,alessandro rudi;raffaello camoriano;lorenzo rosasco
1457115475,automatic machine learning automl,2015-07-06,f hutter;b kegl;r caruana;i guyon;h larochelle;e viegas
1471542436,aslib a benchmark library for algorithm selection,2016-08-01,bernd bischl;pascal kerschke;lars kotthoff;marius lindauer;yuri malitsky;alexandre frechette;holger h hoos;frank hutter;kevin leytonbrown;kevin tierney;joaquin vanschoren
1481746448,discriminant laplacian embedding,2010-07-11,hua wang;heng huang;chris h q ding
1482242411,dynamic objectness for adaptive tracking,2012-11-05,severin stalder;helmut grabner;luc van gool
1483064949,discriminative recurrent sparse auto encoders,2013-01-16,jason tyler rolfe;yann lecun
1483870316,you only look once unified real time object detection,2016-06-01,joseph redmon;santosh kumar divvala;ross b girshick;ali farhadi
1484210532,multiple object recognition with visual attention,2015-01-01,jimmy ba;volodymyr mnih;koray kavukcuoglu
1484371059,bundle adjustment in the large,2010-09-05,sameer agarwal;noah snavely;steven m seitz;richard szeliski
1485009520,convolutional lstm network a machine learning approach for precipitation nowcasting,2015-12-07,xingjian shi;zhourong chen;hao wang;dit yan yeung;wai kin wong;wangchun woo
1486649854,skip thought vectors,2015-12-07,ryan kiros;yukun zhu;ruslan salakhutdinov;richard s zemel;antonio torralba;raquel urtasun;sanja fidler
1487621638,on testing answer set programs,2010-08-04,tomi janhunen;ilkka niemela;johannes oetsch;jorg puhrer;hans tompits
1487641199,generative moment matching networks,2015-01-01,yujia li;kevin swersky;richard s zemel;richard s zemel
1491468723,fast large scale optimization by unifying stochastic gradient and quasi newton methods,2014-01-01,jascha sohldickstein;ben poole;surya ganguli
1491666714,paraphrases and applications,2010-08-01,shiqi zhao;haifeng wang
1491719799,brief binary robust independent elementary features,2010-09-05,michael calonder;vincent lepetit;christoph strecha;pascal fua
1492129349,learning neighborhoods for metric learning,2012-09-24,jun wang;adam woznica;alexandros kalousis
1492420801,ridge regression hubness and zero shot learning,2015-09-07,yutaro shigeto;ikumi suzuki;kazuo hara;masashi shimbo;yuji matsumoto
1493213172,robust portfolio optimization,2015-12-07,huitong qiu;fang han;han liu;brian s caffo
1495304293,online community detection for large complex networks,2013-08-03,wangsheng zhang;gang pan;zhaohui wu;shijian li
1495981708,a multi pass sieve for coreference resolution,2010-10-01,karthik raghunathan;heeyoung lee;sudarshan rangarajan;nathanael chambers;mihai surdeanu;daniel jurafsky;christopher d manning
1496650988,neural activation constellations unsupervised part model discovery with convolutional networks,2015-12-01,marcel simon;erik rodner
