paperID,paper title,publish years,authors
2142498761,weisfeiler lehman graph kernels,2011-02-01,nino shervashidze;pascal schweitzer;erik jan van leeuwen;kurt mehlhorn;karsten m borgwardt
2142642186,dynamic location models,2014-07-03,vanessa murdock
2142726150,learning graphs to match,2013-12-01,minsu cho;karteek alahari;jean ponce
2142771691,improving image matting using comprehensive sampling sets,2013-06-01,ehsan shahrian;deepu rajan;brian l price;scott d cohen
2142838865,web scale k means clustering,2010-04-26,d sculley
2142881874,discrete graph hashing,2014-01-01,wei liu;cun mu;sanjiv kumar;shihfu chang
2142972908,jointly modeling aspects ratings and sentiments for movie recommendation jmars,2014-08-24,qiming diao;minghui qiu;chaoyuan wu;alexander j smola;jing jiang;chong wang
2143042284,bayesian hierarchical reinforcement learning,2012-01-01,feng cao;soumya ray
2143267104,mining actionlet ensemble for action recognition with depth cameras,2012-06-01,jiang wang;zicheng liu;ying wu;junsong yuan
2143387805,active learning for networked data,2010-01-01,mustafa bilgic;lilyana mihalkova;lise getoor
2143646512,sparse online topic models,2013-05-13,aonan zhang;jun zhu;bo zhang
2143737536,extended and unscented gaussian processes,2014-01-01,daniel m steinberg;edwin v bonilla
2143822352,distributed matrix completion,2012-12-01,christina teflioudi;faraz makari;rainer gemulla
2143842970,script recognition a review,2010-12-01,debashis ghosh;tulika dube;adamane p shivaprasad
2144041313,computing the stereo matching cost with a convolutional neural network,2015-06-01,jure zbontar;yann lecun
2144115358,accelerated mini batch randomized block coordinate descent method,2014-01-01,tuo zhao;mo yu;yiming wang;raman arora;han liu
2144193737,stochastic gradient hamiltonian monte carlo,2014-01-01,tianqi chen;emily b fox;carlos guestrin
2144335278,distributed k means and k median clustering on general topologies,2013-01-01,mariaflorina balcan;steven ehrlich;yingyu liang
2144459347,scalable multi class object detection,2011-06-01,nima razavi;juergen gall;luc van gool
2144487656,recommender systems with social regularization,2011-02-09,hao ma;dengyong zhou;chao liu;michael r lyu;irwin king
2144533338,efficient optimization for sparse gaussian process regression,2015-12-01,yanshuai cao;marcus a brubaker;david j fleet;aaron hertzmann
2144794286,semantic contours from inverse detectors,2011-11-01,bharath hariharan;pablo arbelaez;lubomir d bourdev;subhransu maji;jitendra malik
2144960104,generation and comprehension of unambiguous object descriptions,2016-06-01,junhua mao;jonathan huang;alexander toshev;oana maria camburu;alan l yuille;kevin p murphy
2145110208,model based aligner combination using dual decomposition,2011-06-01,john denero;klaus macherey
2145178286,parametric task learning,2013-01-01,ichiro takeuchi;tatsuya hongo;masashi sugiyama;shinichi nakajima
2145183542,optimizing instructional policies,2013-01-01,robert v lindsey;michael c mozer;william j huggins;harold pashler
2145328215,density based logistic regression,2013-08-11,wenlin chen;yixin chen;yi mao;baolong guo
2145342134,worst case linear discriminant analysis,2010-01-01,yu zhang;dit yan yeung
2145544171,holographic embeddings of knowledge graphs,2016-02-12,maximilian nickel;lorenzo rosasco;tomaso poggio
2145656406,topic partitioned multinetwork embeddings,2012-01-01,peter krafft;juston moore;bruce a desmarais;hanna m wallach
2145736866,on bootstrapping recommender systems,2010-10-26,nadav golbandi;yehuda koren;ronny lempel
2145763471,scalable kernel methods via doubly stochastic gradients,2014-01-01,bo dai;bo xie;niao he;yingyu liang;anant raj;mariaflorina balcan;le song
2145872245,location aware instant search,2012-10-29,ruicheng zhong;ju fan;guoliang li;kianlee tan;lizhu zhou
2145983039,learning to count objects in images,2010-01-01,victor s lempitsky;andrew zisserman
2146001804,hylien a hybrid approach to general list extraction on the web,2011-03-28,fabio fumarola;tim weninger;rick barber;donato malerba;jiawei han
2146024151,image annotation using metric learning in semantic neighbourhoods,2012-10-07,yashaswi verma;c v jawahar
2146752454,recommending collaborators using keywords,2013-05-13,sara cohen;lior ebel
2146938707,models of cooperative teaching and learning,2011-02-01,sandra zilles;steffen lange;robert c holte;martin zinkevich
2147017814,one permutation hashing,2012-01-01,ping li;art b owen;cunhui zhang
2147154374,echoes of power language effects and power differences in social interaction,2012-04-16,cristian danescuniculescumizil;lillian lee;bo pang;jon m kleinberg
2147318913,efficient image dehazing with boundary constraint and contextual regularization,2013-12-01,gaofeng meng;ying wang;jiangyong duan;shiming xiang;chunhong pan
2147527908,recurrent models of visual attention,2014-01-01,volodymyr mnih;nicolas heess;alex graves;koray kavukcuoglu
2147860430,robust data driven dynamic programming,2013-01-01,grani adiwena hanasusanto;daniel kuhn
2147860648,tiled convolutional neural networks,2010-01-01,jiquan ngiam;zhenghao chen;daniel chia;pang w koh;quoc v le;andrew y ng
2148049954,making space suits,2014-09-13,amy ross
2148134229,searchable web sites recommendation,2011-02-09,yang song;nam nguyen;liwei he;scott k imig;robert l rounthwaite
2148312679,beta process joint dictionary learning for coupled feature spaces with application to single image super resolution,2013-06-01,li he;hairong qi;russell zaretzki
2148349024,discriminative unsupervised feature learning with convolutional neural networks,2014-01-01,alexey dosovitskiy;jost tobias springenberg;martin a riedmiller;thomas brox
2148367931,term level search result diversification,2013-07-28,van dang;bruce croft
2148544545,query languages for graph databases,2012-04-25,peter t wood
2148554573,cartesian k means,2013-06-01,mohammad norouzi;david j fleet
2149166950,speedy q learning,2011-01-01,mohammad ghavamzadeh;hilbert j kappen;mohammad gheshlaghi azar;remi munos
2149544245,adaptive manifold learning,2012-02-01,zhenyue zhang;jing wang;hongyuan zha
2149547418,on query result diversification,2011-04-01,marcos r vieira;humberto luiz razente;maria camila nardini barioni;marios hadjieleftheriou;divesh srivastava;caetano traina;vassilis j tsotras
2149684715,mlpack a scalable c machine learning library,2013-01-01,ryan r curtin;james r cline;n p slagle;william b march;parikshit ram;nishant a mehta;alexander g gray
2149694199,depth from combining defocus and correspondence using light field cameras,2013-12-01,michael w tao;sunil hadap;jitendra malik;ravi ramamoorthi
2149731329,agnostic bayesian learning of ensembles,2014-01-01,alexandre lacoste;mario marchand;francois laviolette;hugo larochelle
2149803014,kernel entropy component analysis,2010-05-01,robert jenssen
2149822245,optimal real time bidding for display advertising,2014-08-24,weinan zhang;shuai yuan;jun wang
2149933564,how transferable are features in deep neural networks,2014-01-01,jason yosinski;jeff clune;yoshua bengio;hod lipson
2149991085,a feature selection method for multivariate performance measures,2013-09-01,qi mao;waihung tsang
2150081556,anchored neighborhood regression for fast example based super resolution,2013-12-01,radu timofte;vincent de;luc van gool
2150190641,robust point set registration using gaussian mixture models,2011-08-01,bing jian;baba c vemuri
2150227699,standardized mutual information for clustering comparisons one step further in adjustment for chance,2014-01-01,simone romano;james bailey;vinh nguyen;karin verspoor
2150546315,learning latent tree graphical models,2011-02-01,myung jin choi;vincent y f tan;animashree anandkumar;alan s willsky
2150579495,large scale l bfgs using mapreduce,2014-01-01,weizhu chen;zhenghao wang;jingren zhou
2150905308,gaussian process preference elicitation,2010-01-01,shengbo guo;scott sanner;edwin v bonilla
2151009539,the interestingness of images,2013-12-01,michael gygli;helmut grabner;hayko riemenschneider;fabian nater;luc van gool
2151095918,hyperanf approximating the neighbourhood function of very large graphs on a budget,2011-03-28,paolo boldi;marco rosa;sebastiano vigna
2151175804,grouping based low rank trajectory completion and 3d reconstruction,2014-01-01,katerina fragkiadaki;marta salas;pablo arbelaez;jitendra malik
2151178372,end to end learning of lda by mirror descent back propagation over a deep architecture,2015-12-07,jianshu chen;ji he;yelong shen;lin xiao;xiaodong he;jianfeng gao;xinying song;li deng
2151228446,sequential bayesian search,2013-01-01,zheng wen;branislav kveton;brian eriksson;sandilya bhamidipati
2151237105,safe exploration in markov decision processes,2012-01-01,teodor mihai moldovan;pieter abbeel
2151645025,processing top k join queries,2010-09-01,minji wu;laure bertiequille;amelie marian;cecilia m procopiuc;divesh srivastava
2151793306,divide and conquer matrix factorization,2011-01-01,lester w mackey;michael i jordan;ameet talwalkar
2151813316,ontology based data management,2011-10-24,maurizio lenzerini
2151889438,the gesture recognition toolkit,2014-01-01,nicholas gillian;joseph a paradiso
2151930506,efficient parallel set similarity joins using mapreduce,2010-06-06,rares vernica;michael j carey;chen li
2151951067,tracking adversarial targets,2014-01-01,yasin abbasiyadkori;peter l bartlett;varun kanade
2151965738,natural evolution strategies,2014-01-01,daan wierstra;tom schaul;tobias glasmachers;yi sun;jan peters;jurgen schmidhuber
2152020329,sparse single index model,2013-01-01,pierre alquier;gerard biau
2152131136,structured face hallucination,2013-06-01,chihyuan yang;sifei liu;minghsuan yang
2152654418,a framework for automatic modeling from point cloud data,2013-11-01,charalambos poullis
2152705104,deciphering the face,2011-06-01,aleix m martinez
2152729429,pidgin ontology alignment using web text as interlingua,2013-10-27,derry tanti wijaya;partha pratim talukdar;tom m mitchell
2152837238,a streaming parallel decision tree algorithm,2010-03-01,yael benhaim;elad tomtov
2152915516,a computational approach to the syntax of displacement and the semantics of scope,2010-03-31,christina unger
2153125595,learning with hierarchical deep models,2013-08-01,ruslan salakhutdinov;joshua b tenenbaum;antonio torralba
2153150702,crowdsourcing for information retrieval,2012-01-09,matthew lease;emine yilmaz
2153250079,finding subgraphs with maximum total density and limited overlap,2015-02-02,oana denisa balalau;francesco bonchi;th hubert chan;francesco gullo;mauro sozio
2153338628,online feature selection with streaming features,2013-05-01,xindong wu;kui yu;wei ding;hao wang;xingquan zhu
2153405862,non sequential structure from motion,2011-11-01,olof enqvist;fredrik kahl;carl olsson
2153439876,online optimization for max norm regularization,2014-01-01,jie shen;huan xu;ping li
2153579005,distributed representations of words and phrases and their compositionality,2013-01-01,tomas mikolov;ilya sutskever;kai chen;gregory s corrado;jeffrey dean
2153925537,dynamic policy programming,2012-01-01,mohammad gheshlaghi azar;vicenc gomez;hilbert j kappen
2154104617,learning networks of stochastic differential equations,2010-01-01,jose pereira;morteza ibrahimi;andrea montanari
2154209944,texture classification from random features,2012-03-01,li liu;paul w fieguth
2154259852,addressing cold start in recommender systems a semi supervised co training algorithm,2014-07-03,mi zhang;jie tang;xuchen zhang;xiangyang xue
2154359981,baselines and bigrams simple good sentiment and topic classification,2012-07-01,sida i wang;christopher d manning
2154389918,on spectral learning,2010-03-01,andreas argyriou;charles a micchelli;massimiliano pontil
2154575165,variational gaussian process state space models,2014-01-01,roger frigola;yutian chen;carl edward rasmussen
2154889144,high speed tracking with kernelized correlation filters,2015-03-01,joao f henriques;rui caseiro;pedro martins;jorge batista
2154921032,on the stability of plan costs and the costs of plan stability,2010-09-01,m abhirama;sourjya bhaumik;atreyee dey;harsh shrimal;jayant r haritsa
2155007355,end to end training of deep visuomotor policies,2016-01-01,sergey levine;chelsea finn;trevor darrell;pieter abbeel
2155196764,reconstructing 3d human pose from 2d image landmarks,2012-10-07,varun ramakrishna;takeo kanade;yaser sheikh
2155249848,mobile panoramic imaging system,2010-06-01,kari pulli;marius tico;yingen xiong
2155292833,generating images from captions with attention,2016-01-01,elman mansimov;emilio parisotto;jimmy ba;ruslan salakhutdinov
2155302366,a quantitative analysis of current practices in optical flow estimation and the principles behind them,2014-01-01,deqing sun;stefan roth;michael j black
2155388965,discovering human interactions in videos with limited data labeling,2015-06-01,mehran khodabandeh;arash vahdat;guangtong zhou;hossein hajimirsadeghi;mehrsan javan roshtkhari;greg mori;stephen se
2155461593,learning to discover social circles in ego networks,2012-01-01,jure leskovec;julian mcauley
2155478180,model ai assignments 2014,2014-07-27,todd w neller;laura e brown;roger l west;james e heliotis;sean strout;ivona bezakova;bikramjit banerjee;daniel lucas thompson
2155534814,active learning and best response dynamics,2014-01-01,mariaflorina balcan;christopher berlind;avrim blum;emma cohen;kaushik patnaik;le song
2156074549,dynamic refraction stereo,2011-08-01,nigel j w morris;kiriakos n kutulakos
2156131541,efficient and accurate discovery of patterns in sequence datasets,2010-03-01,avrilia floratou;sandeep tata;jignesh m patel
2156233801,natural language questions for the web of data,2012-07-01,mohamed yahya;klaus berberich;shady elbassuoni;maya ramanath;volker tresp;gerhard weikum
2156303437,two stream convolutional networks for action recognition in videos,2014-01-01,karen simonyan;andrew zisserman
2156417670,automated variational inference for gaussian process models,2014-01-01,trung v nguyen;edwin v bonilla
2156431679,temporal restricted boltzmann machines for dependency parsing,2011-06-01,nikhil garg;james henderson
2156547346,joint deep learning for pedestrian detection,2013-12-01,wanli ouyang;xiaogang wang
2156695938,authorship attribution using probabilistic context free grammars,2010-07-01,sindhu raghavan;adriana kovashka;raymond j mooney
2156854584,pedestrian recognition with a learned metric,2010-11-08,mert dikmen;emre akbas;thomas s huang;narendra ahuja
2157032868,designing category level attributes for discriminative visual recognition,2013-06-01,felix x yu;liangliang cao;rogerio schmidt feris;john r smith;shihfu chang
2157163421,a computational approach to politeness with application to social factors,2013-08-01,cristian danescuniculescumizil;moritz sudhof;daniel jurafsky;jure leskovec;christopher potts
2157442454,bayesian optimal active search and surveying,2012-01-01,roman garnett;yamuna krishnamurthy;xuehan xiong;richard p mann;jeff g schneider
2157565459,online moving camera background subtraction,2012-10-07,ali elqursh;ahmed m elgammal
2157593377,enhanced results for web search,2011-07-24,kevin haas;peter mika;paul tarjan;roi blanco
2157774966,sparse space time deconvolution for calcium image analysis,2014-01-01,ferran diego andilla;fred a hamprecht
2157838043,coding images with local features,2011-09-01,timo dickscheid;falko schindler;wolfgang forstner
2157881433,collaborative deep learning for recommender systems,2015-08-10,hao wang;naiyan wang;dit yan yeung
2158028897,knowledge graph and text jointly embedding,2014-10-01,zhen wang;jianwen zhang;jianlin feng;zheng chen
2158131535,sinkhorn distances lightspeed computation of optimal transport,2013-01-01,marco cuturi
2158139921,metric learning to rank,2010-01-01,brian mcfee;gert r g lanckriet
2158469249,sample based approximate regularization,2014-01-01,philip bachman;amir massoud farahmand;amir massoud farahmand;doina precup
2158592639,object tracking benchmark,2015-09-01,yi wu;jongwoo lim;minghsuan yang
2158890446,forecastable component analysis,2013-01-01,georg m goerg
2158899491,natural language processing almost from scratch,2011-02-01,ronan collobert;jason weston;leon bottou;michael karlen;koray kavukcuoglu;pavel p kuksa
2158908968,discovering social circles in ego networks,2014-02-01,julian mcauley;jure leskovec
2159187228,mondrian forests efficient online random forests,2014-01-01,balaji lakshminarayanan;daniel m roy;yee whye teh
2159187711,object detection by 3d aspectlets and occlusion reasoning,2013-12-01,yu xiang;silvio savarese
2159245256,forest density estimation,2011-02-01,han liu;min xu;haijie gu;anupam gupta;john d lafferty;larry wasserman
2159291411,learning transferable features with deep adaptation networks,2015-01-01,mingsheng long;mingsheng long;yue cao;jianmin wang;michael i jordan
2159514277,modeling review comments,2012-07-01,arjun mukherjee;bing liu
2159542831,top k pipe join,2010-03-01,davide martinenghi;marco tagliasacchi
2159849946,universal option models,2014-01-01,hengshuai yao;csaba szepesvari;richard s sutton;joseph modayil;shalabh bhatnagar
2160017075,multi sentence compression finding shortest paths in word graphs,2010-08-01,katja filippova
2160072137,lsd a fast line segment detector with a false detection control,2010-04-01,r g von gioi;jeremie jakubowicz;jeanmichel morel;gregory randall
2160158327,discovering latent network structure in point process data,2014-01-01,scott w linderman;ryan p adams
2160390542,usage analysis and the web of data,2011-05-24,bettina berendt;laura hollink;vera hollink;markus luczakrosch;knud moller;david vallet
2160424986,probabilistic bag of hyperlinks model for entity linking,2016-04-11,octavianeugen ganea;marina ganea;aurelien lucchi;carsten eickhoff;thomas hofmann
2160817396,linear discriminant dimensionality reduction,2011-09-05,quanquan gu;zhenhui li;jiawei han
2161105493,multiscale dictionary learning for estimating conditional distributions,2013-01-01,francesca petralia;joshua t vogelstein;david b dunson
2161208721,texture synthesis using convolutional neural networks,2015-12-07,leon a gatys;alexander s ecker;matthias bethge
2161758346,expectation backpropagation parameter free training of multilayer neural networks with continuous or discrete weights,2014-01-01,daniel soudry;itay hubara;ron meir
2161777432,clustering algorithms for chains,2011-02-01,antti ukkonen
2161841481,boosting classifier cascades,2010-01-01,nuno vasconcelos;mohammad j saberian
2162214498,mining top k high utility itemsets,2012-08-12,cheng wei wu;bai en shie;vincent s tseng;philip s yu
2162371870,systems for big graphs,2014-08-01,arijit khan;sameh elnikety
2162390675,deep learning with cots hpc systems,2013-01-01,adam coates;brody huval;tao wang;david j wu;bryan catanzaro;ng andrew
2162456950,efficient non parametric estimation of multiple embeddings per word in vector space,2014-10-01,arvind neelakantan;jeevan shankar;alexandre passos;andrew mccallum
2162670686,learning fair representations,2013-01-01,richard s zemel;yu wu;kevin swersky;toniann pitassi;cynthia dwork
2163112044,task driven dictionary learning,2012-04-01,julien mairal;francis r bach;jean ponce
2163422235,byteslice pushing the envelop of main memory data processing with a new storage layout,2015-05-27,ziqiang feng;eric lo;ben kao;wenjian xu
2163561827,large scale semantic parsing via schema matching and lexicon extension,2013-08-01,qingqing cai;alexander yates
2163605009,imagenet classification with deep convolutional neural networks,2012-01-01,alex krizhevsky;ilya sutskever;geoffrey e hinton
2163776610,multi label relational neighbor classification using social context features,2013-08-11,xi wang;gita sukthankar
2163811596,propto svm for learning with label proportions,2013-01-01,felix x yu;dong liu;sanjiv kumar;jebara tony;shihfu chang
2164019165,improving word representations via global context and multiple word prototypes,2012-07-01,eric h huang;richard socher;christopher d manning;andrew y ng
2164370980,the dropout learning algorithm,2014-05-01,pierre baldi;peter j sadowski
2164379666,heavyweight pattern mining in attributed flow graphs,2014-12-01,carolina simoes gomes;jose nelson amaral;joerg sander;joran siu;li ding
2164411961,weight uncertainty in neural network,2015-01-01,charles blundell;julien cornebise;koray kavukcuoglu;daan wierstra
2164545125,pairwise ranking aggregation in a crowdsourced setting,2013-02-04,xi chen;paul n bennett;kevyn collinsthompson;eric horvitz
2164613257,nonparametric variational inference,2012-01-01,samuel j gershman;matthew d hoffman;david m blei
2164728239,regularized discriminant analysis ridge regression and beyond,2010-03-01,zhihua zhang;guang dai;congfu xu;michael i jordan
2165037244,real time compressive tracking,2012-10-07,kaihua zhang;lei zhang;minghsuan yang
2165093166,challenges and opportunities with big data,2012-08-01,alexandros labrinidis;h v jagadish
2165107586,automatic exposure correction of consumer photographs,2012-10-07,lu yuan;jian sun
2165141262,deep sequential neural network,2014-12-12,ludovic denoyer;patrick gallinari
2165150801,deterministic policy gradient algorithms,2014-01-01,david silver;guy lever;nicolas heess;thomas degris;daan wierstra;martin a riedmiller
2165219242,new insights from coarse word sense disambiguation in the crowd,2012-12-01,adam kapelner;krishna kaliannan;h andrew schwartz;lyle h ungar;dean p foster
2165279024,sparse additive generative models of text,2011-01-01,jacob eisenstein;amr ahmed;eric p xing
2165337236,deep coding network,2010-01-01,yuanqing lin;zhang tong;shenghuo zhu;kai yu
2165390807,dynamic information retrieval modeling,2015-02-02,hui yang;marc sloan;jun wang
2165418571,slice sampling normalized kernel weighted completely random measure mixture models,2012-01-01,nicholas j foti;sinead a williamson
2165599843,online learning for latent dirichlet allocation,2010-01-01,matthew d hoffman;francis r bach;david m blei
2165653993,feature engineering and classifier ensemble for kdd cup 2010,2010-01-01,hsiangfu yu;hungyi lo;hsun ping hsieh;jingkai lou;todd g mckenzie;jungwei chou;pohan chung;chiahua ho;chunfu chang;juiyu weng;ensyu yan;chewei chang;tsungting kuo;chienyuan wang;yihung huang;yuxun ruan;yushi lin;shoude lin;hsuantien lin;chihjen lin
2165833485,structure learning for optimization,2011-01-01,shulin lynn yang;ali rahimi
2165878420,processing and visualizing the data in tweets,2012-01-11,adam marcus;michael s bernstein;osama badar;david r karger;samuel madden;robert c miller
2165926940,phrase structure parsing with dependency structure,2010-08-01,zhiguo wang;chengqing zong
2165971212,neighbor query friendly compression of social networks,2010-07-25,hossein maserrat;jian pei
2166027445,minimum probability flow learning,2011-01-01,jascha sohldickstein;peter battaglino;michael r deweese
2166058103,kernel bayes rule,2011-01-01,kenji fukumizu;le song;arthur gretton
2166371785,projective dictionary pair learning for pattern classification,2014-01-01,shuhang gu;lei zhang;wangmeng zuo;xiangchu feng
2166448571,distributed auction based initialization of mobile robot formations,2010-07-11,robert louis long;ross mead;jerry b weinberg
2166489517,incremental slow feature analysis,2011-07-16,varun raj kompella;matthew d luciw;jurgen schmidhuber
2166650627,saliency detection via absorbing markov chain,2013-12-01,bowen jiang;lihe zhang;huchuan lu;chuan yang;minghsuan yang
2166706236,parallelized stochastic gradient descent,2010-01-01,martin zinkevich;markus weimer;lihong li;alexander j smola
2166794017,node based learning of multiple gaussian graphical models,2014-01-01,karthik mohan;palma london;maryam fazel;daniela m witten;suin lee
2166851633,stochastic variational inference,2013-01-01,matthew d hoffman;david m blei;chong wang;john paisley
2166926978,future of the web and search,2011-07-24,qi lu
2167187514,identifying relations for open information extraction,2011-07-01,anthony fader;stephen soderland;oren etzioni
2167266300,word salad relating food prices and descriptions,2012-07-01,victor chahuneau;kevin gimpel;bryan r routledge;lily scherlis;noah a smith
2167348665,iterative neural autoregressive distribution estimator nade k,2014-01-01,tapani raiko;yao li;kyunghyun cho;yoshua bengio
2167396130,shortest paths with curvature and torsion,2013-12-01,petter strandmark;johannes ulen;fredrik kahl;leo grady
2167445298,trend filtering on graphs,2016-01-01,yuxiang wang;james sharpnack;alexander j smola;ryan j tibshirani
2167589764,more accurate pinhole camera calibration with imperfect planar target,2011-11-01,klaus h strobl;gerd hirzinger
2167623372,manopt a matlab toolbox for optimization on manifolds,2014-01-01,nicolas boumal;bamdev mishra;pierreantoine absil;rodolphe sepulchre
2167747244,linear sequence to sequence alignment,2010-02-01,flavio luis cardeal padua;rodrigo l carceroni;geraldo a m r santos;kiriakos n kutulakos
2168009253,the virtual lab,2013-02-04,duncan j watts
2168048236,what the web can t do,2010-04-26,david a shamma;seth fitzsimmonds;joe gregorio;adam stevens hupp;ramesh jain;kevin marks
2168231600,large scale distributed deep networks,2012-01-01,jeffrey dean;greg s corrado;rajat monga;kai chen;matthieu devin;mark mao;marcaurelio ranzato;andrew w senior;paul a tucker;ke yang;quoc v le;andrew y ng
2168284908,alid scalable dominant cluster detection,2015-04-01,lingyang chu;shuhui wang;siyuan liu;qingming huang;jian pei
2168356304,object detection with discriminatively trained part based models,2010-09-01,pedro f felzenszwalb;ross b girshick;david a mcallester;deva ramanan
2168607921,the activity based computing project,2011-01-01,jakob e bardram
2168762867,from search to observation,2013-05-13,ian c brown;wendy hall;lisa harris
2168810201,pac subset selection in stochastic multi armed bandits,2012-01-01,shivaram kalyanakrishnan;ambuj tewari;peter auer;peter stone
2168947765,streaming variational bayes,2013-01-01,tamara broderick;nicholas boyd;andre wibisono;ashia c wilson;michael i jordan
