paperID,paper title,publish years,authors
2521201813,adagio fast data aware near isometric linear embeddings,2016-12-01,jaroslaw blasiok;charalampos e tsourakakis
2521441617,multi level semantic labelling of numerical values,2016-10-17,sebastian neumaier;jurgen umbrich;josiane xavier parreira;axel polleres
2521500513,the lrp toolbox for artificial neural networks,2016-01-01,sebastian lapuschkin;alexander binder;gregoire montavon;klaus robert muller;wojciech samek
2521672687,column networks for collective classification,2017-01-01,trang pham;truyen tran;dinh q phung;svetha venkatesh
2522576347,food food in open data,2016-10-17,silvio peroni;giorgia lodi;luigi asprino;aldo gangemi;valentina presutti
2522578306,deep impression audiovisual deep residual networks for multimodal apparent personality trait recognition,2016-10-08,yagmur gucluturk;umut guclu;marcel a j van gerven;rob van lier
2522800861,linked disambiguated distributional semantic networks,2016-10-17,stefano faralli;alexander panchenko;chris biemann;simone paolo ponzetto
2522934936,zika virus infection,2016-07-11,i b yershova;t f osypova
2523060838,on large batch training for deep learning generalization gap and sharp minima,2017-04-24,nitish shirish keskar;dheevatsa mudigere;jorge nocedal;mikhail smelyanskiy;ping tak peter tang
2523469089,seqgan sequence generative adversarial nets with policy gradient,2016-01-01,lantao yu;weinan zhang;jun wang;yong yu
2523714292,photo realistic single image super resolution using a generative adversarial network,2017-07-01,christian ledig;lucas theis;ferenc huszar;jose caballero;andrew cunningham;alejandro acosta;andrew p aitken;alykhan tejani;johannes totz;zehan wang;wenzhe shi
2523717353,text simplification for children,2010-01-01,jan de belder;mariefrancine moens
2524570426,top n recommendation on graphs,2016-10-24,zhao kang;chong peng;ming yang;qiang cheng
2524638710,fusing similarity models with markov chains for sparse sequential recommendation,2016-12-01,ruining he;julian mcauley
2525332836,pointer sentinel mixture models,2017-04-24,stephen merity;caiming xiong;james bradbury;richard socher
2525579820,aaai conference on artificial intelligence,2011-01-01,eirini kaldeli;alexander lazovik;marco aiello
2525734268,unsupervised neural hidden markov models,2016-01-01,ke m tran;yonatan bisk;ashish vaswani;daniel marcu;kevin knight
2525763657,cut tree construction from massive graphs,2016-12-01,takuya akiba;yoichi iwata;yosuke sameshima;naoto mizuno;yosuke yano
2525954470,input convex neural networks,2016-01-01,brandon amos;lei xu;j zico kolter
2526075485,sparse representation based open set recognition,2017-08-01,he zhang;vishal m patel
2526174222,image embodied knowledge representation learning,2017-08-01,ruobing xie;zhiyuan liu;huanbo luan;maosong sun
2526354482,an investigation of recurrent neural architectures for drug name recognition,2016-01-01,raghavendra chalapathy;ehsan zare borzeshi;massimo piccardi
2526547295,languages for mining and learning,2015-07-18,luc de raedt
2526662185,incorporating relation paths in neural relation extraction,2017-01-01,wenyuan zeng;yankai lin;zhiyuan liu;maosong sun
2526726692,scalable discrete supervised hash learning with asymmetric matrix factorization,2016-12-01,shifeng zhang;jianmin li;jinma guo;bo zhang
2527012259,scenic routes now efficiently solving the time dependent arc orienteering problem,2017-11-06,ying lu;gregor josse;tobias emrich;ugur demiryurek;matthias renz;cyrus shahabi;matthias schubert
2527467788,emoji2vec learning emoji representations from their description,2016-01-01,ben eisner;tim rocktaschel;isabelle augenstein;matko bosnjak;sebastian riedel
2527928270,neural based noise filtering from word embeddings,2016-01-01,kim anh nguyen;sabine schulte im walde;ngoc thang vu
2528051032,asynchronous multi task learning,2016-12-01,inci m baytas;ming yan;anil k jain;jiayu zhou
2528144785,multiple kernel k means clustering with matrix induced regularization,2016-02-12,xinwang liu;yong dou;jianping yin;lei wang;en zhu
2529272619,creating summaries from user videos,2014-09-06,michael gygli;helmut grabner;hayko riemenschneider;luc van gool;luc van gool
2529448179,structured inference networks for nonlinear state space models,2017-01-01,rahul g krishnan;uri shalit;david sontag
2529769424,video pixel networks,2016-01-01,nal kalchbrenner;aaron van den oord;karen simonyan;ivo danihelka;oriol vinyals;alex graves;koray kavukcuoglu
2529970985,bayesian tensor regression,2017-01-01,rajarshi guhaniyogi;shaan qamar;david b dunson
2530372461,learning what and where to draw,2016-01-01,scott e reed;zeynep akata;santosh mohan;samuel tenka;bernt schiele;honglak lee
2530395818,equality of opportunity in supervised learning,2016-01-01,moritz hardt;eric price;nathan srebro
2530816535,temporal ensembling for semi supervised learning,2017-04-24,samuli laine;timo aila
2530823353,a greedy approach for budgeted maximum inner product search,2017-01-01,hsiangfu yu;chojui hsieh;qi lei;inderjit s dhillon
2530982843,modelling sentence pairs with tree structured attentive encoder,2016-01-01,yao zhou;cong liu;yan pan
2531327146,a baseline for detecting misclassified and out of distribution examples in neural networks,2017-04-24,dan hendrycks;kevin gimpel
2531409750,xception deep learning with depthwise separable convolutions,2017-07-01,francois chollet
2531425418,deep pyramidal residual networks,2017-07-01,dongyoon han;jiwhan kim;junmo kim
2532034655,hadamard product for low rank bilinear pooling,2017-04-24,jinhwa kim;kyoung woon on;woosang lim;jeonghee kim;jungwoo ha;byoungtak zhang
2532227130,recommendations for streaming data,2016-10-24,karthik subbian;charu c aggarwal;kshiteesh hegde
2532280165,cyberrank knowledge elicitation for risk assessment of database security,2016-10-24,hagit cohen;oded sofer;ofer biller;bracha shapira;lior rokach
2532579422,a simple algorithm for computing nash equilibria in incomplete information games,2016-12-05,elvis dohmatob
2532610538,measuring metrics,2016-10-24,pavel dmitriev;xian wu
2532619792,arbitrary arrow update logic,2017-01-01,hans van ditmarsch;wiebe van der hoek;barteld kooi;louwe b kuijer
2532807140,pre translation for neural machine translation,2016-01-01,jan niehues;eunah cho;thanhle ha;alex waibel
2532931541,a theme rewriting approach for generating algebra word problems,2016-01-01,rik koncelkedziorski;ioannis konstas;luke zettlemoyer;hannaneh hajishirzi
2533110648,efficient computation of importance based communities in web scale networks using a single machine,2016-10-24,shu chen;ran wei;diana popova;alex thomo
2534071615,scalable local recoding anonymization using locality sensitive hashing for big data privacy preservation,2016-10-24,xuyun zhang;christopher leckie;wanchun dou;jinjun chen;ramamohanarao kotagiri;zoran salcic
2534159769,modeling scalability of distributed machine learning,2017-04-01,alexander ulanov;andrey simanovsky;manish marwah
2534189265,user response learning for directly optimizing campaign performance in display advertising,2016-10-24,kan ren;weinan zhang;yifei rong;haifeng zhang;yong yu;jun wang
2534209241,active zero shot learning,2016-10-24,sihong xie;shaoxiong wang;philip s yu
2535178740,incremental ensemble classifier addressing non stationary fast data streams,2014-12-01,brandon parker;latifur khan;albert bifet
2535697732,using fast weights to attend to the recent past,2016-01-01,jimmy ba;geoffrey e hinton;volodymyr mnih;joel z leibo;catalin ionescu
2536015822,a deep relevance matching model for ad hoc retrieval,2016-10-24,jiafeng guo;yixing fan;qingyao ai;w bruce croft
2536131596,factorized databases,2016-09-28,dan olteanu;maximilian schleich
2536223907,active network alignment a matching based approach,2017-11-06,eric malmi;aristides gionis;evimaria terzi
2536991335,medical question answering for clinical decision support,2016-10-24,travis goodwin;sanda m harabagiu
2537027648,cached long short term memory neural networks for document level sentiment classification,2016-01-01,jiacheng xu;danlu chen;xipeng qiu;xuangjing huang
2537475616,vandalism detection in wikidata,2016-10-24,stefan heindorf;martin potthast;benno stein;gregor engels
2537776792,generalizing translation models in the probabilistic relevance framework,2016-10-24,navid rekabsaz;mihai lupu;allan hanbury;guido zuccon
2538418548,content based image retrieval using uniform local binary patterns,2016-01-01,sumaira muhammad hayat khan;ayyaz hussain
2539060820,lda revisited entropy prior and convergence,2016-10-24,jianwei zhang;jia zeng;mingxuan yuan;weixiong rao;jianfeng yan
2539247542,lambdafm learning optimal ranking with factorization machines using lambda surrogates,2016-10-24,fajie yuan;guibing guo;joemon m jose;long chen;haitao yu;weinan zhang
2541244035,learning to reason with adaptive computation,2016-12-09,mark neumann;pontus stenetorp;sebastian riedel
2541407868,maximally divergent intervals for anomaly detection,2016-01-01,erik rodner;bjorn barz;yanira guanche;milan flach;miguel d mahecha;paul bodesheim;markus reichstein;joachim denzler
2543205374,single pass pca of matrix products,2016-01-01,shanshan wu;srinadh bhojanapalli;sujay sanghavi;alexandros g dimakis
2543927648,universal adversarial perturbations,2017-07-01,seyedmohsen moosavidezfooli;alhussein fawzi;omar fawzi;pascal frossard
2544224704,soundnet learning sound representations from unlabeled video,2016-01-01,yusuf aytar;carl vondrick;antonio torralba
2544271936,review networks for caption generation,2016-12-05,zhilin yang;ye yuan;yuexin wu;william w cohen;ruslan salakhutdinov
2544587078,end to end learning of deep visual representations for image retrieval,2017-09-01,albert gordo;jon almazan;jerome revaud;diane larlus
2544745230,mlr machine learning in r,2016-01-01,bernd bischl;michel lang;lars kotthoff;julia schiffner;jakob richter;erich studerus;giuseppe casalicchio;zachary m jones
2544912866,doubly convolutional neural networks,2016-12-05,shuangfei zhai;yu cheng;weining lu;zhongfei mark zhang
2545656684,a learned representation for artistic style,2017-04-24,vincent dumoulin;jonathon shlens;manjunath kudlur
2546314413,temporal models for predicting student dropout in massive open online courses,2015-11-01,mi fei;dit yan yeung
2546563948,learning to pivot with adversarial networks,2016-11-03,gilles louppe;michael kagan;k cranmer
2546589867,estimating cortical feature maps with dependent gaussian processes,2017-10-01,nicholas j hughes;geoffrey j goodhill
2546786407,machine learning in the real world,2016-09-01,vineet chaoji;rajeev rastogi;gourav roy
2546905097,operational analytics data management systems,2016-09-01,alexander bohm;jens dittrich;niloy mukherjee;ippokrantis pandis;rajkumar sen
2546915671,lightrnn memory and computation efficient recurrent neural networks,2016-01-01,xiang li;tao qin;jian yang;tieyan liu
2546938941,dual learning for machine translation,2016-01-01,di he;yingce xia;tao qin;liwei wang;nenghai yu;tieyan liu;weiying ma
2547063557,trends and challenges in big data processing,2016-09-01,ion stoica
2547190417,systemml declarative machine learning on spark,2016-09-01,matthias boehm;michael w dusenberry;deron eriksson;alexandre v evfimievski;faraz makari manshadi;niketan pansare;berthold reinwald;frederick r reiss;prithviraj sen;arvind c surve;shirish tatikonda
2547410375,modern main memory database systems,2016-09-01,perake larson;justin j levandoski
2547418827,phased lstm accelerating recurrent network training for long or event based sequences,2016-12-05,daniel neil;michael pfeiffer;shihchii liu
2547432194,tensor switching networks,2016-12-05,chuanyung tsai;andrew m saxe;david d cox
2547446130,learning deep embeddings with histogram loss,2016-01-01,evgeniya ustinova;victor s lempitsky
2547718140,full capacity unitary recurrent neural networks,2016-12-05,scott wisdom;thomas powers;john r hershey;jonathan le roux;les e atlas
2547788783,robust kernel density estimation,2012-01-01,jooseuk kim;clayton scott
2547912976,binary paragraph vectors,2017-04-24,karol grzegorczyk;marcin kurdziel
2548275288,conditional image synthesis with auxiliary classifier gans,2017-04-24,augustus odena;christopher olah;jonathon shlens
2548424944,using computer vision to see,2016-10-08,bogdan mocanu;bogdan mocanu;ruxandra tapu;ruxandra tapu;titus b zaharia
2548441712,chinese poetry generation with planning based neural network,2016-01-01,zhe wang;wei he;hua wu;haiyang wu;wei li;haifeng wang;enhong chen
2548527721,optical flow estimation using a spatial pyramid network,2017-07-01,anurag ranjan;michael j black
2548613432,locationspark a distributed in memory data management system for big spatial data,2016-09-01,mingjie tang;yongyang yu;qutaibah m malluhi;mourad ouzzani;walid g aref
2548762611,dscaler synthetically scaling a given relational database,2016-10-01,ji zhang;y c tay
2548896705,a system for region search and exploration,2016-09-01,kaiyu feng;kaiqi zhao;yiding liu;gao cong
2548961596,towards personalized maps mining user preferences from geo textual data,2016-09-01,kaiqi zhao;yiding liu;quan yuan;lisi chen;zhida chen;gao cong
2549035799,qualitative data cleaning,2016-09-01,xu chu;ihab f ilyas
2549119524,multi information source optimization,2017-01-01,matthias poloczek;jialei wang;peter i frazier
2549139847,aggregated residual transformations for deep neural networks,2017-07-01,saining xie;ross b girshick;piotr dollar;zhuowen tu;kaiming he
2549293531,iterative refinement of the approximate posterior for directed belief networks,2016-01-01,devon r hjelm;ruslan salakhutdinov;kyunghyun cho;nebojsa jojic;vince d calhoun;junyoung chung
2549334782,adversarial multiclass classification a risk minimization perspective,2016-01-01,rizal fathony;anqi liu;kaiser asif;brian d ziebart
2549362047,low rank regression with tensor responses,2016-01-01,guillaume rabusseau;hachem kadri
2549401308,fully adaptive feature sharing in multi task networks with applications in person attribute classification,2017-07-01,yongxi lu;abhishek kumar;shuangfei zhai;yu cheng;tara javidi;rogerio schmidt feris
2549416390,tying word vectors and word classifiers a loss framework for language modeling,2017-04-24,hakan inan;khashayar khosravi;richard socher
2549599535,a hierarchical approach for generating descriptive image paragraphs,2017-07-01,jonathan krause;justin johnson;ranjay krishna;li feifei
2549618015,alternating direction graph matching,2017-07-01,d khue lehuu;nikos paragios
2549858646,hard aware deeply cascaded embedding,2017-10-01,yuhui yuan;kuiyuan yang;chao zhang
2549898883,learning kernels with random features,2016-01-01,aman sinha;john c duchi
2549918709,the product cut,2016-01-01,thomas laurent;james h von brecht;xavier bresson;arthur szlam
2549922054,long term causal effects via behavioral game theory,2016-01-01,panagiotis toulis;david c parkes
2550503735,noise tolerant life long matrix completion via adaptive sampling,2016-01-01,mariaflorina balcan;hongyang zhang
2550673061,controlling perceptual factors in neural style transfer,2017-07-01,leon a gatys;alexander s ecker;matthias bethge;aaron hertzmann;eli shechtman
2550802162,a fast and provable method for estimating clique counts using turan s theorem,2017-04-03,shweta jain;c seshadhri
2550831128,lcnn lookup based convolutional neural network,2017-07-01,hessam bagherinezhad;mohammad rastegari;ali farhadi
2551080748,the power of optimization from samples,2016-01-01,eric balkanski;aviad rubinstein;yaron singer
2551156993,supervised learning with tensor networks,2016-01-01,edwin miles stoudenmire;david schwab
2551361256,multilingual knowledge graph embeddings for cross lingual knowledge alignment,2017-08-01,muhao chen;yingtao tian;mohan yang;carlo zaniolo
2551396370,bidirectional attention flow for machine comprehension,2017-04-24,min joon seo;aniruddha kembhavi;ali farhadi;hannaneh hajishirzi
2551572271,lip reading sentences in the wild,2017-07-01,joon son chung;andrew w senior;oriol vinyals;andrew zisserman
2551687757,building deep networks on grassmann manifolds,2018-02-07,zhiwu huang;jiqing wu;luc van gool
2551829638,factorized bilinear models for image recognition,2017-10-01,yanghao li;naiyan wang;jiaying liu;xiaodi hou
2551887912,reinforcement learning with unsupervised auxiliary tasks,2017-04-24,max jaderberg;volodymyr mnih;wojciech marian czarnecki;tom schaul;joel z leibo;david silver;koray kavukcuoglu
2551906536,deep feature interpolation for image content changes,2017-07-01,paul upchurch;jacob r gardner;geoff pleiss;robert pless;noah snavely;kavita bala;kilian q weinberger
2551925796,a probabilistic programming approach to probabilistic data analysis,2016-01-01,feras saad;vikash k mansinghka
2552002300,dense captioning with joint inference and visual context,2017-07-01,linjie yang;kevin tang;jianchao yang;lijia li
2552027021,dynamic coattention networks for question answering,2017-04-24,caiming xiong;victor zhong;richard socher
2552111036,learning fully convolutional networks for iterative non blind deconvolution,2017-07-01,jiawei zhang;jinshan pan;weisheng lai;rynson w h lau;minghsuan yang
2552147134,active discriminative text representation learning,2017-01-01,ye zhang;matthew lease;byron c wallace
2552149088,deep learning for predicting human strategic behavior,2016-01-01,jason s hartford;james r wright;kevin leytonbrown
2552383788,learning a deep embedding model for zero shot learning,2017-07-01,li zhang;tao xiang;shaogang gong
2552391307,interaction networks for learning about objects relations and physics,2016-12-05,peter battaglia;razvan pascanu;matthew lai;danilo jimenez rezende;koray kavukcuoglu
2552391848,improving training of deep neural networks via singular value bounding,2017-07-01,kui jia;dacheng tao;shenghua gao;xiangmin xu
2552414813,simple does it weakly supervised instance and semantic segmentation,2017-07-01,anna khoreva;rodrigo benenson;jan hendrik hosang;matthias hein;bernt schiele
2552465644,image to image translation with conditional adversarial networks,2017-07-01,phillip isola;junyan zhu;tinghui zhou;alexei a efros
2552531400,one shot video object segmentation,2017-07-01,sergi caelles;keviskokitsi maninis;jordi ponttuset;laura lealtaixe;daniel cremers;l van gool
2552723767,blind regression nonparametric regression for latent variable models via collaborative filtering,2016-01-01,dogyoon song;christina e lee;yihua li;devavrat shah
2552900565,deep feature flow for video recognition,2017-07-01,xizhou zhu;yuwen xiong;jifeng dai;lu yuan;yichen wei
2553303224,neural architecture search with reinforcement learning,2017-04-24,barret zoph;quoc v le
2553374874,an architecture for deep hierarchical generative models,2016-01-01,philip bachman
2553397501,quasi recurrent neural networks,2017-04-24,james bradbury;stephen merity;caiming xiong;richard socher
2553474785,object recognition with and without objects,2017-08-01,zhuotun zhu;lingxi xie;alan l yuille
2553498075,deep neural networks with inexact matching for person re identification,2016-01-01,arulkumar subramaniam;moitreya chatterjee;anurag mittal
2553594924,spatiotemporal residual networks for video action recognition,2016-01-01,christoph feichtenhofer;axel pinz;richard p wildes
2553701371,learning to act by predicting the future,2017-04-24,alexey dosovitskiy;vladlen koltun
2553897675,unsupervised cross domain image generation,2017-04-24,yaniv taigman;adam polyak;lior wolf
2553915786,deepsense a unified deep learning framework for time series mobile sensing data processing,2017-04-03,shuochao yao;shaohan hu;yiran zhao;aston zhang;tarek f abdelzaher
2554120691,combining policy gradient and q learning,2017-04-24,brendan odonoghue;remi munos;koray kavukcuoglu;volodymyr mnih
2554247908,coarse to fine volumetric prediction for single image 3d human pose,2017-07-01,georgios pavlakos;xiaowei zhou;konstantinos g derpanis;kostas daniilidis
2554305618,near optimal active learning of halfspaces via query synthesis in the noisy setting,2017-01-01,lin chen;seyed hamed hassani;amin karbasi
2554314924,unrolled generative adversarial networks,2017-04-24,luke metz;ben poole;david pfau;jascha sohldickstein
2554423077,semantic segmentation using adversarial networks,2016-12-01,pauline luc;camille couprie;soumith chintala;jakob j verbeek
2554506842,generative multi adversarial networks,2017-04-24,ishan p durugkar;ian gemp;sridhar mahadevan
2554592357,loss aware binarization of deep networks,2017-04-24,lu hou;quanming yao;james tinyau kwok
2554631900,heuristic planning for pddl domains,2016-07-09,wiktor mateusz piotrowski;maria fox;derek long;daniele magazzeni;fabio mercorio
2554931888,learning the number of neurons in deep networks,2016-01-01,jose m alvarez;mathieu salzmann
2555182955,fully convolutional instance aware semantic segmentation,2017-07-01,yi li;haozhi qi;jifeng dai;xiangyang ji;yichen wei
2555308822,learning continuous semantic representations of symbolic expressions,2017-04-24,miltiadis allamanis;pankajan chanthirasegaran;pushmeet kohli;charles a sutton
2555599621,tractable operations for arithmetic circuits of probabilistic models,2016-01-01,yujia shen;arthur choi;adnan darwiche
2555618208,multi view 3d object detection network for autonomous driving,2017-07-01,xiaozhi chen;huimin ma;ji wan;bo li;tian xia
2555751471,associative embedding end to end learning for joint detection and grouping,2017-01-01,alejandro newell;zhiao huang;jia deng
2555808560,interpretable encoding of densities using possibilistic logic,2016-08-01,ondrej kuzelka;jesse davis;steven schockaert
2555897561,improved deep metric learning with multi class n pair loss objective,2016-01-01,kihyuk sohn
2556096924,adversarial training methods for semi supervised text classification,2017-04-24,takeru miyato;andrew m dai;ian j goodfellow
2556114170,clustering signed networks with the geometric mean of laplacians,2016-01-01,pedro mercado;francesco tudisco;matthias hein
2556364298,deep information propagation,2017-04-24,samuel s schoenholz;justin gilmer;surya ganguli;jascha sohldickstein
2556436003,an urn model for majority voting in classification ensembles,2016-12-05,victor soto;alberto suarez;gonzalo martinezmunoz
2556455135,dsac differentiable ransac for camera localization,2017-07-01,eric brachmann;alexander krull;sebastian nowozin;jamie shotton;frank michel;stefan gumhold;carsten rother
2556511880,computational models of narrative,2010-01-01,floris bex;bart verheij
2556522401,hyperband a novel bandit based approach to hyperparameter optimization,2017-01-01,lisha li;kevin g jamieson;giulia desalvo;afshin rostamizadeh;ameet talwalkar
2556738441,poisson gamma dynamical systems,2016-01-01,aaron schein;hanna m wallach;mingyuan zhou
2556754073,query complexity of tournament solutions,2016-01-01,palash dey
2556802233,octnet learning deep 3d representations at high resolutions,2017-07-01,gernot riegler;ali osman ulusoy;andreas geiger
2556833785,designing neural network architectures using reinforcement learning,2017-04-24,bowen baker;otkrist gupta;nikhil naik;ramesh raskar
2556873163,supervised word mover s distance,2016-12-05,gao huang;chuan quo;matt j kusner;yu sun;kilian q weinberger;fei sha
2556893918,straight to shapes real time detection of encoded shapes,2017-07-01,saumya jetley;michael sapienza;stuart golodetz;philip h s torr
2556952061,fast fourier color constancy,2017-07-01,jonathan t barron;yunta tsai
2557166550,geodesic distance descriptors,2017-07-01,gil shamai;ron kimmel
2557264465,hierarchical boundary aware neural encoder for video captioning,2017-07-01,lorenzo baraldi;costantino grana;rita cucchiara
2557269700,learning shape abstractions by assembling volumetric primitives,2017-07-01,shubham tulsiani;hao su;leonidas j guibas;alexei a efros;jitendra malik
2557270725,capacity and trainability in recurrent neural networks,2017-04-24,jasmine collins;jascha sohldickstein;david sussillo
2557321428,learning to compose words into sentences with reinforcement learning,2017-04-24,dani yogatama;phil blunsom;chris dyer;edward grefenstette;wang ling
2557406251,full resolution residual networks for semantic segmentation in street scenes,2017-07-01,tobias pohlen;alexander hermans;markus mathias;bastian leibe
2557414982,high resolution image inpainting using multi scale neural patch synthesis,2017-07-01,chao yang;xin lu;zhe lin;eli shechtman;oliver wang;hao li
2557465155,semantic scene completion from a single depth image,2017-07-01,shuran song;fisher yu;andy zeng;angel x chang;manolis savva;thomas a funkhouser
2557505065,bayesian optimization for probabilistic programs,2016-01-01,tom rainforth;tuan anh le;janwillem van de meent;michael a osborne;frank d wood
2557579533,deep variational information bottleneck,2017-04-24,alexander a alemi;ian fischer;joshua v dillon;kevin p murphy
2557641257,eco efficient convolution operators for tracking,2017-07-01,martin danelljan;goutam bhat;fahad shahbaz khan;michael felsberg
2557728737,speed accuracy trade offs for modern convolutional object detectors,2017-07-01,jonathan huang;vivek rathod;chen sun;menglong zhu;anoop korattikara;alireza fathi;ian fischer;zbigniew wojna;yang song;sergio guadarrama;kevin p murphy
2557889580,deep watershed transform for instance segmentation,2017-07-01,min bai;raquel urtasun
2558071586,geometry of compositionality,2017-01-01,hongyu gong;suma bhat;pramod viswanath
2558476738,knowledge graph representation with jointly structural and textual encoding,2017-08-01,jiacheng xu;xipeng qiu;kan chen;xuanjing huang
2558535589,modeling relationships in referential expressions with compositional modular networks,2017-07-01,ronghang hu;marcus rohrbach;jacob andreas;trevor darrell;kate saenko
2558661413,split brain autoencoders unsupervised learning by cross channel prediction,2017-07-01,richard y zhang;phillip isola;alexei a efros
2558687333,bottleneck conditional density estimation,2016-01-01,rui shu;hung hai bui;mohammad ghavamzadeh
2558737541,variational autoencoder for semi supervised text classification,2017-01-01,weidi xu;haoze sun;chao deng;ying tan
